{
  "id": "11111111-1111-4111-8111-111111111111",
  "type": "sale.completed",
  "occurredAt": "2026-09-18T08:00:00Z",
  "organizationRef": "org_demo",
  "payload": {
    "saleId": "22222222-2222-4222-8222-222222222222",
    "branchId": "33333333-3333-4333-8333-333333333333",
    "currency": "GEL",
    "grossAmount": 42.5
  }
}